{
  "schema_version": "0.1.0",
  "run_id": "task_semantics_diagnostic",
  "git_commit": "0b4ad970b232d9c9ec3d99834cbee82df6eaffa2",
  "git_dirty": true,
  "task_contract_sha256": "61795eb3e46695a8ef837266003d92665db0fc424ed29dc976b1d14f22bf6750",
  "platform": "windows",
  "simulator": "isaac_sim_physx",
  "algorithm": "scripted",
  "seed": 0,
  "num_envs": 2,
  "status": "failed",
  "started_at_utc": "2026-09-04T07:26:19.509722+00:00",
  "finished_at_utc": "2026-09-04T07:26:31.604256+00:00",
  "config_sha256": "fe8723824fdd0320555384432b6a664b0a740970515488991c5dcc18863b2364",
  "checkpoint_uri": null,
  "checkpoint_sha256": null,
  "metrics_path": "reports/windows/task_semantics_diagnostic.json",
  "notes": "task semantics validation; classification=failed"
}
