{
  "schema_version": "0.1.0",
  "run_id": "pp_g3",
  "git_commit": "ddb1583a4a6fd78a0e93865e0dcf7b238e914f09",
  "git_dirty": false,
  "task_contract_sha256": "5cef9bc9bd04fb98678b65758e043dbe419e6044992eb4e740765db2d9c46de1",
  "platform": "windows",
  "simulator": "isaac_sim_physx",
  "algorithm": "random",
  "seed": 0,
  "num_envs": 64,
  "status": "completed",
  "started_at_utc": "2026-09-12T04:22:57.322471+00:00",
  "finished_at_utc": "2026-09-12T04:25:38.890765+00:00",
  "config_sha256": "f359dd1505278db7302840493377b64399ba453cabb305604d347c1faa7f8ee3",
  "checkpoint_uri": null,
  "checkpoint_sha256": null,
  "metrics_path": "artifacts/pick_place_20260912/pp_g3.json",
  "notes": "bounded smoke; requested_physics_steps=10000; classification=runtime_validated"
}
