{
  "schema_version": "0.1.0",
  "run_id": "g4_so101_64env_resume_final",
  "git_commit": "3f7628d0d58dd0b0181ea45e902ff35f81248967",
  "git_dirty": false,
  "task_contract_sha256": "61795eb3e46695a8ef837266003d92665db0fc424ed29dc976b1d14f22bf6750",
  "platform": "windows",
  "simulator": "isaac_sim_physx",
  "algorithm": "ppo",
  "seed": 0,
  "num_envs": 64,
  "status": "completed",
  "started_at_utc": "2026-09-04T07:40:39.100934+00:00",
  "finished_at_utc": "2026-09-04T07:40:56.178832+00:00",
  "config_sha256": "7cc490d2b215a3648b8b23a46bc9bd036d0fa8479bc51cf01579c14f4315c929",
  "checkpoint_uri": "C:\\Users\\LIMMM\\so101-pick-rl\\isaaclab\\logs\\rsl_rl\\so101_lift_cube\\2026-09-04_16-40-49_g4_resume_final\\model_10.pt",
  "checkpoint_sha256": "33caefdff8c8fc4e7421b97fb44f2e73503b58eaf7d7cd92c7037b467861e14e",
  "metrics_path": "reports/windows/g4_so101_64env_resume_final.json",
  "notes": "RSL-RL PPO; iterations=1; classification=measured"
}
