{
  "schema_version": "0.1.0",
  "run_id": "pp_g4",
  "git_commit": "a678ceda7dad1b9bc6d1c50c28a663fcc83fdb21",
  "git_dirty": false,
  "task_contract_sha256": "f4af446ce9644e558653da595d34b0c752dde974e3951051dee7d8d672dc52d3",
  "platform": "windows",
  "simulator": "isaac_sim_physx",
  "algorithm": "ppo",
  "seed": 0,
  "num_envs": 64,
  "status": "completed",
  "started_at_utc": "2026-09-12T04:46:38.857127+00:00",
  "finished_at_utc": "2026-09-12T04:47:07.884482+00:00",
  "config_sha256": "3c5219feb20a1ea8db76893c5930404b04460ad3e4f13fa19600ec62cbffeddd",
  "checkpoint_uri": "C:\\Users\\LIMMM\\so101-pick-rl\\isaaclab\\logs\\rsl_rl\\so101_pick_place\\2026-09-12_13-46-45_pp_r2_g4\\model_9.pt",
  "checkpoint_sha256": "d551ba7aff77bf956f8a1282c35f1b2cfb3c6fe455c2148faad9443acc37ac29",
  "metrics_path": "artifacts/pick_place_20260912_r2/pp_g4.json",
  "notes": "RSL-RL PPO; iterations=10; classification=measured"
}
