{
  "schema_version": "0.1.0",
  "run_id": "pp_resume",
  "git_commit": "a678ceda7dad1b9bc6d1c50c28a663fcc83fdb21",
  "git_dirty": false,
  "task_contract_sha256": "f4af446ce9644e558653da595d34b0c752dde974e3951051dee7d8d672dc52d3",
  "platform": "windows",
  "simulator": "isaac_sim_physx",
  "algorithm": "ppo",
  "seed": 0,
  "num_envs": 64,
  "status": "completed",
  "started_at_utc": "2026-09-12T04:47:29.630538+00:00",
  "finished_at_utc": "2026-09-12T04:47:43.789332+00:00",
  "config_sha256": "bb0d0b2ac07511ca6b1347b4688bfd4cba78f3c6f2a60f7f12bcb08c47591766",
  "checkpoint_uri": "C:\\Users\\LIMMM\\so101-pick-rl\\isaaclab\\logs\\rsl_rl\\so101_pick_place\\2026-09-12_13-47-35_pp_r2_resume\\model_11.pt",
  "checkpoint_sha256": "38a3bbb340024301d17649157bf85c8399fb3141684aff6e3e0a1e8caeca39fc",
  "metrics_path": "artifacts/pick_place_20260912_r2/pp_resume.json",
  "notes": "RSL-RL PPO; iterations=2; classification=measured"
}
