{
  "schema_version": "0.1.0",
  "run_id": "g3_so101_64env_10000_final",
  "git_commit": "7f63f4ba3159c8951395997c44988a7a32c8ddcb",
  "git_dirty": false,
  "task_contract_sha256": "61795eb3e46695a8ef837266003d92665db0fc424ed29dc976b1d14f22bf6750",
  "platform": "windows",
  "simulator": "isaac_sim_physx",
  "algorithm": "random",
  "seed": 0,
  "num_envs": 64,
  "status": "completed",
  "started_at_utc": "2026-09-04T07:36:03.581741+00:00",
  "finished_at_utc": "2026-09-04T07:38:39.971153+00:00",
  "config_sha256": "a3355384afa45a4cc976ad31a440278a2f06fa600f2d3b62b813c3b44a89593c",
  "checkpoint_uri": null,
  "checkpoint_sha256": null,
  "metrics_path": "reports/windows/g3_so101_64env_10000_final.json",
  "notes": "bounded smoke; requested_physics_steps=10000; classification=runtime_validated"
}
