{
  "schema_version": "0.1.0",
  "run_id": "pp_g2",
  "git_commit": "a678ceda7dad1b9bc6d1c50c28a663fcc83fdb21",
  "git_dirty": false,
  "task_contract_sha256": "f4af446ce9644e558653da595d34b0c752dde974e3951051dee7d8d672dc52d3",
  "platform": "windows",
  "simulator": "isaac_sim_physx",
  "algorithm": "scripted",
  "seed": 0,
  "num_envs": 1,
  "status": "completed",
  "started_at_utc": "2026-09-12T04:42:08.224765+00:00",
  "finished_at_utc": "2026-09-12T04:42:34.322977+00:00",
  "config_sha256": "4391e3061b7b4d1385276e0d0ee46e144db746bedca011908018926b263f2600",
  "checkpoint_uri": null,
  "checkpoint_sha256": null,
  "metrics_path": "artifacts/pick_place_20260912_r2/pp_g2.json",
  "notes": "bounded smoke; requested_physics_steps=1000; classification=runtime_validated"
}
