{
  "schema_version": "0.1.0",
  "run_id": "task_semantics_diagnostic_retry2",
  "git_commit": "0b4ad970b232d9c9ec3d99834cbee82df6eaffa2",
  "git_dirty": true,
  "task_contract_sha256": "61795eb3e46695a8ef837266003d92665db0fc424ed29dc976b1d14f22bf6750",
  "platform": "windows",
  "simulator": "isaac_sim_physx",
  "algorithm": "scripted",
  "seed": 0,
  "num_envs": 2,
  "status": "completed",
  "started_at_utc": "2026-09-04T07:28:31.878139+00:00",
  "finished_at_utc": "2026-09-04T07:28:46.971665+00:00",
  "config_sha256": "ff5621931cf226695aab203df5bd515c3fe6efa370612d761f47cbe84f719a65",
  "checkpoint_uri": null,
  "checkpoint_sha256": null,
  "metrics_path": "reports/windows/task_semantics_diagnostic_retry2.json",
  "notes": "task semantics validation; classification=runtime_validated"
}
